                                                                                                                                                                                                                                                                                                                                                                                                                                                                    
18:34:31.826410 IP 192.168.0.194 > srijita: ICMP echo request, id 1, seq 1, length 64
18:34:32.836606 IP 10.0.0.1 > srijita: ICMP echo request, id 1, seq 2, length 64
18:34:33.860575 IP 192.168.0.194 > srijita: ICMP echo request, id 1, seq 3, length 64
18:34:34.884625 IP 192.168.0.194 > srijita: ICMP echo request, id 1, seq 4, length 64
18:34:35.908613 IP 192.168.0.194 > srijita: ICMP echo request, id 1, seq 5, length 64
18:34:36.936594 IP 192.168.0.194 > srijita: ICMP echo request, id 1, seq 6, length 64
18:34:37.960550 IP 192.168.0.194 > srijita: ICMP echo request, id 1, seq 7, length 64
18:34:38.980585 IP 192.168.0.194 > srijita: ICMP echo request, id 1, seq 8, length 64
18:34:40.008631 IP 192.168.0.194 > srijita: ICMP echo request, id 1, seq 9, length 64
18:34:41.028551 IP 192.168.0.194 > srijita: ICMP echo request, id 1, seq 10, length 64
18:34:42.052630 IP 192.168.0.194 > srijita: ICMP echo request, id 1, seq 11, length 64
18:34:43.076640 IP 192.168.0.194 > srijita: ICMP echo request, id 1, seq 12, length 64

